### ISSUE TITLE
avahi not responding to .local queries

### ISSUE THREAD

**Issue by fnoop** [fnoop/maverick#263]

**Comment by fnoop** [comment]
tcpdump shows multicast requests being received and responded to.  works sometimes.

**Comment by fnoop** [comment]
This seems to be fine, will reopen if occurs again with evidence.

**Comment by fnoop** [comment]
Captured an event:
```
06:57:07.051176 IP Doms-Mac.home.mdns > 224.0.0.251.mdns: 0 [2q] A (QU)? fnoop-odroid.local. AAAA (QU)? fnoop-odroid.local. (42)
06:57:07.053329 IP6 fe80::c6a:b08:97ba:e0b7.mdns > ff02::fb.mdns: 0 [2q] A (QU)? fnoop-odroid.local. AAAA (QU)? fnoop-odroid.local. (42)
06:57:08.058720 IP6 fe80::c6a:b08:97ba:e0b7.mdns > ff02::fb.mdns: 0 [2q] A (QM)? fnoop-odroid.local. AAAA (QM)? fnoop-odroid.local. (42)
06:57:08.060015 IP Doms-Mac.home.mdns > 224.0.0.251.mdns: 0 [2q] A (QM)? fnoop-odroid.local. AAAA (QM)? fnoop-odroid.local. (42)
06:57:11.068439 IP Doms-Mac.home.mdns > 224.0.0.251.mdns: 0 [2q] A (QM)? fnoop-odroid.local. AAAA (QM)? fnoop-odroid.local. (42)
06:57:11.070835 IP6 fe80::c6a:b08:97ba:e0b7.mdns > ff02::fb.mdns: 0 [2q] A (QM)? fnoop-odroid.local. AAAA (QM)? fnoop-odroid.local. (42)
06:57:21.063619 IP Doms-Mac.home.mdns > 224.0.0.251.mdns: 0 PTR (QM)? _googlecast._tcp.local. (40)
06:57:21.064652 IP6 fe80::c6a:b08:97ba:e0b7.mdns > ff02::fb.mdns: 0 PTR (QM)? _googlecast._tcp.local. (40)
```
```
$ ssh mav@fnoop-odroid.local
ssh: Could not resolve hostname fnoop-odroid.local: nodename nor servname provided, or not known
```

**Comment by fnoop** [comment]
Kind of seen this before:
https://github.com/fnoop/maverick/issues/206

**Comment by fnoop** [comment]
AARGH, odroid is still set to hostname odroid, not fnoop-odroid.  Closing due to gross stupidity.
